{
  "strategy_type": "PortfolioAllocation",
  "allocation_type": "QS-002",
  "portfolioNotional": 30000.0,
  "maxGrossExposure": 1.25,
  "momentumLookback": 3,
  "momentumLegSize": 2,
  "minTradeQuantity": 0.01,
  "contracts": [
    {
      "symbol": "GOOGL",
      "secType": "STOCK",
      "currency": "USD",
      "exchange": "IBKR"
    },
    {
      "symbol": "AVGO",
      "secType": "STOCK",
      "currency": "USD",
      "exchange": "IBKR"
    },
    {
      "symbol": "GOOG",
      "secType": "STOCK",
      "currency": "USD",
      "exchange": "IBKR"
    },
    {
      "symbol": "META",
      "secType": "STOCK",
      "currency": "USD",
      "exchange": "IBKR"
    },
    {
      "symbol": "TSLA",
      "secType": "STOCK",
      "currency": "USD",
      "exchange": "IBKR"
    },
    {
      "symbol": "BRK.B",
      "secType": "STOCK",
      "currency": "USD",
      "exchange": "IBKR"
    }
  ],
  "ledgerPath": "data/TraderLedger/QS002_GOOGL_BASKET_WEEKLY_30K_IBKR",
  "ledgerContextCollection": "QS002_GOOGL_BASKET_WEEKLY_30K_IBKR_context"
}
