{
  "strategy_type": "PortfolioAllocation",
  "allocation_type": "QS-001",
  "portfolioNotional": 30000.0,
  "targetVolatility": 0.25,
  "maxGrossExposure": 1.25,
  "volatilityWindow": 6,
  "minTradeQuantity": 0.01,
  "contracts": [
    {
      "symbol": "META",
      "secType": "STOCK",
      "currency": "USD",
      "exchange": "IBKR"
    },
    {
      "symbol": "TSLA",
      "secType": "STOCK",
      "currency": "USD",
      "exchange": "IBKR"
    },
    {
      "symbol": "BRK.B",
      "secType": "STOCK",
      "currency": "USD",
      "exchange": "IBKR"
    },
    {
      "symbol": "JPM",
      "secType": "STOCK",
      "currency": "USD",
      "exchange": "IBKR"
    },
    {
      "symbol": "LLY",
      "secType": "STOCK",
      "currency": "USD",
      "exchange": "IBKR"
    },
    {
      "symbol": "MU",
      "secType": "STOCK",
      "currency": "USD",
      "exchange": "IBKR"
    }
  ],
  "ledgerPath": "data/TraderLedger/QS001_META_BASKET_WEEKLY_30K_IBKR",
  "ledgerContextCollection": "QS001_META_BASKET_WEEKLY_30K_IBKR_context"
}
