{
  "strategy_type": "PortfolioAllocation",
  "allocation_type": "QS-002",
  "portfolioNotional": 30000.0,
  "maxGrossExposure": 1.25,
  "momentumLookback": 3,
  "momentumLegSize": 2,
  "minTradeQuantity": 0.01,
  "contracts": [
    {
      "symbol": "JNJ",
      "secType": "STOCK",
      "currency": "USD",
      "exchange": "IBKR"
    },
    {
      "symbol": "INTC",
      "secType": "STOCK",
      "currency": "USD",
      "exchange": "IBKR"
    },
    {
      "symbol": "COST",
      "secType": "STOCK",
      "currency": "USD",
      "exchange": "IBKR"
    },
    {
      "symbol": "NVDA",
      "secType": "STOCK",
      "currency": "USD",
      "exchange": "IBKR"
    },
    {
      "symbol": "AAPL",
      "secType": "STOCK",
      "currency": "USD",
      "exchange": "IBKR"
    },
    {
      "symbol": "MSFT",
      "secType": "STOCK",
      "currency": "USD",
      "exchange": "IBKR"
    }
  ],
  "ledgerPath": "data/TraderLedger/QS002_JNJ_BASKET_WEEKLY_30K_IBKR",
  "ledgerContextCollection": "QS002_JNJ_BASKET_WEEKLY_30K_IBKR_context"
}
