{
  "strategy_type": "PortfolioAllocation",
  "allocation_type": "QS-001",
  "portfolioNotional": 30000.0,
  "targetVolatility": 0.25,
  "maxGrossExposure": 1.25,
  "volatilityWindow": 6,
  "minTradeQuantity": 0.01,
  "contracts": [
    {
      "symbol": "AAPL",
      "secType": "STOCK",
      "currency": "USD",
      "exchange": "IBKR"
    },
    {
      "symbol": "MSFT",
      "secType": "STOCK",
      "currency": "USD",
      "exchange": "IBKR"
    },
    {
      "symbol": "AMZN",
      "secType": "STOCK",
      "currency": "USD",
      "exchange": "IBKR"
    },
    {
      "symbol": "GOOGL",
      "secType": "STOCK",
      "currency": "USD",
      "exchange": "IBKR"
    },
    {
      "symbol": "AVGO",
      "secType": "STOCK",
      "currency": "USD",
      "exchange": "IBKR"
    },
    {
      "symbol": "GOOG",
      "secType": "STOCK",
      "currency": "USD",
      "exchange": "IBKR"
    }
  ],
  "ledgerPath": "data/TraderLedger/QS001_AAPL_BASKET_WEEKLY_30K_IBKR",
  "ledgerContextCollection": "QS001_AAPL_BASKET_WEEKLY_30K_IBKR_context"
}
