{
  "strategy_type": "PortfolioAllocation",
  "allocation_type": "PAIRS-001",
  "portfolioNotional": 100000.0,
  "maxGrossExposure": 1.25,
  "pairWindow": 8,
  "pairEntryZ": 0.8,
  "pairExitZ": 0.2,
  "minTradeQuantity": 0.01,
  "contracts": [
    {
      "symbol": "LLY",
      "secType": "STOCK",
      "currency": "USD",
      "exchange": "IBKR"
    },
    {
      "symbol": "MU",
      "secType": "STOCK",
      "currency": "USD",
      "exchange": "IBKR"
    },
    {
      "symbol": "AMD",
      "secType": "STOCK",
      "currency": "USD",
      "exchange": "IBKR"
    },
    {
      "symbol": "XOM",
      "secType": "STOCK",
      "currency": "USD",
      "exchange": "IBKR"
    },
    {
      "symbol": "WMT",
      "secType": "STOCK",
      "currency": "USD",
      "exchange": "IBKR"
    },
    {
      "symbol": "V",
      "secType": "STOCK",
      "currency": "USD",
      "exchange": "IBKR"
    }
  ],
  "pairs": [
    {
      "left": "LLY",
      "right": "MU"
    },
    {
      "left": "AMD",
      "right": "XOM"
    },
    {
      "left": "WMT",
      "right": "V"
    }
  ],
  "ledgerPath": "data/TraderLedger/PAIRS001_LLY_BASKET_WEEKLY_IBKR",
  "ledgerContextCollection": "PAIRS001_LLY_BASKET_WEEKLY_IBKR_context"
}
