{
  "strategy_type": "PortfolioAllocation",
  "allocation_type": "QS-002",
  "portfolioNotional": 30000.0,
  "maxGrossExposure": 1.0572152631592018,
  "momentumLookback": 78,
  "momentumLegSize": 3,
  "minTradeQuantity": 0.01,
  "contracts": [
    {
      "symbol": "NVDA",
      "secType": "STOCK",
      "currency": "USD",
      "exchange": "IBKR"
    },
    {
      "symbol": "AAPL",
      "secType": "STOCK",
      "currency": "USD",
      "exchange": "IBKR"
    },
    {
      "symbol": "MSFT",
      "secType": "STOCK",
      "currency": "USD",
      "exchange": "IBKR"
    },
    {
      "symbol": "AMZN",
      "secType": "STOCK",
      "currency": "USD",
      "exchange": "IBKR"
    },
    {
      "symbol": "GOOGL",
      "secType": "STOCK",
      "currency": "USD",
      "exchange": "IBKR"
    },
    {
      "symbol": "AVGO",
      "secType": "STOCK",
      "currency": "USD",
      "exchange": "IBKR"
    }
  ],
  "ledgerPath": "data/TraderLedger/qs002_nvda_basket_weekly_30k_ibkr_OPTIMIZED",
  "ledgerContextCollection": "qs002_nvda_basket_weekly_30k_ibkr_OPTIMIZED_context"
}
