{
  "strategy_type": "PortfolioAllocation",
  "allocation_type": "QS-002",
  "portfolioNotional": 30000.0,
  "maxGrossExposure": 1.25,
  "momentumLookback": 3,
  "momentumLegSize": 2,
  "minTradeQuantity": 0.01,
  "contracts": [
    {
      "symbol": "JPM",
      "secType": "STOCK",
      "currency": "USD",
      "exchange": "IBKR"
    },
    {
      "symbol": "LLY",
      "secType": "STOCK",
      "currency": "USD",
      "exchange": "IBKR"
    },
    {
      "symbol": "MU",
      "secType": "STOCK",
      "currency": "USD",
      "exchange": "IBKR"
    },
    {
      "symbol": "AMD",
      "secType": "STOCK",
      "currency": "USD",
      "exchange": "IBKR"
    },
    {
      "symbol": "XOM",
      "secType": "STOCK",
      "currency": "USD",
      "exchange": "IBKR"
    },
    {
      "symbol": "WMT",
      "secType": "STOCK",
      "currency": "USD",
      "exchange": "IBKR"
    }
  ],
  "ledgerPath": "data/TraderLedger/QS002_JPM_BASKET_WEEKLY_30K_IBKR",
  "ledgerContextCollection": "QS002_JPM_BASKET_WEEKLY_30K_IBKR_context"
}
