{
  "strategy_type": "PortfolioAllocation",
  "allocation_type": "QS-002",
  "portfolioNotional": 30000.0,
  "maxGrossExposure": 0.558950765678736,
  "momentumLookback": 80,
  "momentumLegSize": 3,
  "minTradeQuantity": 0.01,
  "contracts": [
    {
      "symbol": "MSFT",
      "secType": "STOCK",
      "currency": "USD",
      "exchange": "IBKR"
    },
    {
      "symbol": "AMZN",
      "secType": "STOCK",
      "currency": "USD",
      "exchange": "IBKR"
    },
    {
      "symbol": "GOOGL",
      "secType": "STOCK",
      "currency": "USD",
      "exchange": "IBKR"
    },
    {
      "symbol": "AVGO",
      "secType": "STOCK",
      "currency": "USD",
      "exchange": "IBKR"
    },
    {
      "symbol": "GOOG",
      "secType": "STOCK",
      "currency": "USD",
      "exchange": "IBKR"
    },
    {
      "symbol": "META",
      "secType": "STOCK",
      "currency": "USD",
      "exchange": "IBKR"
    }
  ],
  "ledgerPath": "data/TraderLedger/qs002_msft_basket_weekly_30k_ibkr_OPTIMIZED",
  "ledgerContextCollection": "qs002_msft_basket_weekly_30k_ibkr_OPTIMIZED_context"
}
